{
 "schema_version": "1",
 "harness_version": "1.0",
 "id": "golden-clean-sklearn151to152-imblearn0124",
 "date_ist": "2026-10-10 05:24 IST",
 "who": "runner",
 "machine": "local",
 "host": "runner-01",
 "cpu_count": 8,
 "platform": "Linux-6.12.94+-x86_64-with-glibc2.41",
 "upstream": "scikit-learn",
 "old_version": "1.5.1",
 "new_version": "1.5.2",
 "new_version_requested": "1.5.2",
 "new_direct_url": null,
 "dependent": "imbalanced-learn",
 "dependent_version": "0.12.4",
 "test_source": "wheel (tests shipped in the installed package: imblearn)",
 "test_selection": "imblearn",
 "subset_note": null,
 "python": "3.12.15",
 "runs_per_side": 3,
 "workers": "4",
 "cpus": "4-7",
 "mem_cap_gb": 6.0,
 "test_timeout_s": 300,
 "run_timeout_s": 1500,
 "pin_overridden": false,
 "env_diff": [
  "scikit-learn==1.5.1",
  "scikit-learn==1.5.2"
 ],
 "pip_check_new": "ok",
 "pip_check_old": "ok",
 "machine_type": {
  "arch": "x86_64",
  "os": "Linux",
  "platform": "Linux-6.12.94+-x86_64-with-glibc2.41",
  "cpu_count": 8,
  "cpu_model": "Intel(R) Xeon(R) Processor",
  "ram_gb": 15.6,
  "ci": null,
  "runner_name": null,
  "runner_os": null,
  "runner_arch": null,
  "runner_environment": null,
  "image": null,
  "label": "local"
 },
 "thread_env": {
  "OMP_NUM_THREADS": "1",
  "OPENBLAS_NUM_THREADS": "1",
  "MKL_NUM_THREADS": "1",
  "NUMEXPR_NUM_THREADS": "1",
  "VECLIB_MAXIMUM_THREADS": "1",
  "BLIS_NUM_THREADS": "1"
 },
 "dependent_import": {
  "old": {
   "imblearn": "ok"
  },
  "new": {
   "imblearn": "ok"
  }
 },
 "network": "install: allowed (uv from PyPI/nightly index, git clone of the tag); tests: no network (unshare -rn, private network namespace)",
 "per_run": [
  {
   "side": "old",
   "run": 1,
   "exit": 0,
   "seconds": 46.21,
   "passed": 2244,
   "failed": 0,
   "error": 0,
   "collection_errors": 0,
   "skipped": 33,
   "junit": true,
   "pytest_summary": "2239 passed, 32 skipped, 1 xfailed, 5 xpassed, 62 warnings in 45.43s"
  },
  {
   "side": "new",
   "run": 1,
   "exit": 0,
   "seconds": 44.75,
   "passed": 2244,
   "failed": 0,
   "error": 0,
   "collection_errors": 0,
   "skipped": 33,
   "junit": true,
   "pytest_summary": "2239 passed, 32 skipped, 1 xfailed, 5 xpassed, 62 warnings in 43.88s"
  },
  {
   "side": "old",
   "run": 2,
   "exit": 0,
   "seconds": 36.25,
   "passed": 2244,
   "failed": 0,
   "error": 0,
   "collection_errors": 0,
   "skipped": 33,
   "junit": true,
   "pytest_summary": "2239 passed, 32 skipped, 1 xfailed, 5 xpassed, 62 warnings in 35.55s"
  },
  {
   "side": "new",
   "run": 2,
   "exit": 0,
   "seconds": 43.29,
   "passed": 2244,
   "failed": 0,
   "error": 0,
   "collection_errors": 0,
   "skipped": 33,
   "junit": true,
   "pytest_summary": "2239 passed, 32 skipped, 1 xfailed, 5 xpassed, 62 warnings in 42.44s"
  },
  {
   "side": "old",
   "run": 3,
   "exit": 0,
   "seconds": 37.6,
   "passed": 2244,
   "failed": 0,
   "error": 0,
   "collection_errors": 0,
   "skipped": 33,
   "junit": true,
   "pytest_summary": "2239 passed, 32 skipped, 1 xfailed, 5 xpassed, 62 warnings in 36.92s"
  },
  {
   "side": "new",
   "run": 3,
   "exit": 0,
   "seconds": 38.34,
   "passed": 2244,
   "failed": 0,
   "error": 0,
   "collection_errors": 0,
   "skipped": 33,
   "junit": true,
   "pytest_summary": "2239 passed, 32 skipped, 1 xfailed, 5 xpassed, 62 warnings in 37.60s"
  }
 ],
 "gates": {
  "versions_verified": {
   "pass": true,
   "detail": "old scikit-learn==1.5.1, new scikit-learn==1.5.2, imbalanced-learn==0.12.4 on both sides (freeze + import probe)"
  },
  "env_identical_except_upstream": {
   "pass": true,
   "detail": "freeze diff: ['scikit-learn==1.5.1', 'scikit-learn==1.5.2']"
  },
  "venv_isolated": {
   "pass": true,
   "detail": "both venvs created by uv without system site-packages (checked sys.prefix and sys.path)"
  },
  "threads_pinned": {
   "pass": true,
   "detail": "OMP_NUM_THREADS, OPENBLAS_NUM_THREADS, MKL_NUM_THREADS, NUMEXPR_NUM_THREADS, VECLIB_MAXIMUM_THREADS, BLIS_NUM_THREADS = 1 in both envs"
  },
  "runs_complete": {
   "pass": true,
   "detail": "3 runs per side requested (minimum 3); JUnit XML present and no suite timeout on every run"
  },
  "old_side_healthy": {
   "pass": true,
   "detail": "dependent imports on old: {'imblearn': 'ok'}; old side passed [2244, 2244, 2244] tests with collection errors [0, 0, 0]"
  },
  "stability": {
   "pass": true,
   "required": false,
   "detail": "share of tests with the same outcome in every run: old 1.0, new 1.0 (advisory threshold 0.99)"
  },
  "no_secrets_in_logs": {
   "pass": true,
   "required": false,
   "detail": "scrubbed env; no credential-like strings found in logs"
  },
  "schema_valid": {
   "pass": true,
   "detail": "record matches harness/schema/observation.schema.json"
  }
 },
 "accepted": true,
 "classification": {
  "real_break": 0,
  "already_broken": 0,
  "flaky": 0,
  "import_failure": 0,
  "fixed_by_new": 0,
  "lost_tests": 0
 },
 "stability": {
  "tests": 2277,
  "old_stable_rate": 1.0,
  "new_stable_rate": 1.0
 },
 "top_error_signatures_breaks": [],
 "top_error_signatures_already_broken": [],
 "duration_s": {
  "total_wall": 253.6,
  "tests_old_mean": 40.0,
  "tests_new_mean": 42.1
 },
 "expected": "no break: 1.5.2 is a bug-fix release; imbalanced-learn 0.12.4 was the current release for the 1.5 series",
 "expected_class": "no_break",
 "matches_expected": "yes",
 "explanation": {
  "status": "not yet wired",
  "groundedness": null
 },
 "hand_check": null,
 "upstream_issue": null,
 "notes": null,
 "logs": "research/runs/golden-clean-sklearn151to152-imblearn0124",
 "report": "reports/golden-clean-sklearn151to152-imblearn0124/REPORT.md"
}